{
  "$schema": "http://json-schema.org/draft-07/schema#",
  "$id": "https://pokebros.net/schemas/distributions.json",
  "title": "配信ポケモン正本（世代別ファイル）",
  "description": "配信イベントで配布されたポケモン個体の正本。distributions/gen5.json〜gen9.json と champions.json が本スキーマに従う。マスターデータ（pokemon/all.json・games/titles.json 等）をキー/値で参照し、名前等の重複は最小化する。generation はファイル自身が表すため各エントリには持たない（L3ビルドが注入する）。",
  "type": "object",
  "required": ["schemaVersion", "dataset", "entries"],
  "additionalProperties": false,
  "properties": {
    "schemaVersion": { "const": 1 },
    "dataset": {
      "type": "string",
      "description": "gen5 / gen6 / gen7 / gen8 / gen9 / champions",
      "pattern": "^(gen[1-9]|champions)$"
    },
    "generation": {
      "type": ["integer", "null"],
      "description": "このファイルの世代。champions は null（L3が generation:0 を注入）"
    },
    "provenance": {
      "type": "string",
      "description": "このデータの主な出所（例: 'scraper:bulbapedia', 'spreadsheet-migration', 'hand'）"
    },
    "datasetNotes": {
      "type": "array",
      "minItems": 1,
      "items": { "type": "string" },
      "description": "データセット全体の前提知識（例: champions の個体値仕様・HOME転送不可）。表示用の正本。消費側（summary-pages / distribution-app）はここから描画し、べた書きの二重管理をしない"
    },
    "entries": {
      "type": "array",
      "items": { "$ref": "#/$defs/entry" }
    }
  },
  "$defs": {
    "entry": {
      "type": "object",
      "required": ["id", "dexNo", "pokemonName", "games", "eventName", "distributionMethod", "startDate"],
      "additionalProperties": false,
      "properties": {
        "id": {
          "type": "string",
          "description": "配信レコードの管理ID。ファイル内一意。公開URL /pokemon/{id} に使われるため既存IDは凍結・改名禁止。新規IDは世代プレフィックス（05〜09 / CH）に従う。"
        },
        "dexNo": { "type": "integer", "minimum": 1, "description": "全国図鑑No。pokemon/all.json の no を参照" },
        "pokemonName": { "type": "string", "description": "種族名（フォルム抜き）。pokemon/all.json の name_ja と一致すること" },
        "form": { "type": "string", "description": "フォルム名（例: ヒスイのすがた / ボールのもよう）。無フォルムでは省略" },
        "games": {
          "type": "array",
          "minItems": 1,
          "items": { "type": "string" },
          "description": "games/titles.json の id 配列（例 [\"sun\",\"moon\"]、champions は [\"pokemon_champions\"]）。**受け取り先**のソフトを表す。HOME受取配信は [\"home\"]"
        },
        "originGame": {
          "type": "array",
          "minItems": 1,
          "items": { "type": "string" },
          "description": "games/titles.json の id 配列。**Pokémon HOME の「ソフト」欄（オリジンマーク）**を指す。⚠ HOME は似た情報を2つ出しており、**右上の「最後にいたソフト」ではない**（そちらは個体が移動するたびに変わり、HOME内完結の配信では HOME と出る）。受け取り先である games とは別物で、HOME受取配信でのみ両者が食い違う。例: 色違いボルケニオンは games:[\"home\"]（HOMEで受け取る）だが originGame:[\"legends_za\"]（オリジンマークはZA）。**オリジンマークは受け取り時に決まり、その後の交換・送受信では書き換わらない**ので、交換でもらった個体を見ても値は有効（ただし前の持ち主の HOME の言語設定で決まっている点は残る。中南米スペイン語の環境では初回起動特典が Legends: Z-A になる実例がある）。**オリジンマークは版を区別せずペア単位で表示される**（剣盾 / SV / ピカブイ / BDSP）ので、ペアのソフトは常に両方を入れる（SV = [\"scarlet\",\"violet\"]）。⚠ Bulbapedia の \"last game visited\" は単一タイトルを名指しするが**別のフィールドの話**なので、これを根拠に片方へ絞らないこと。**個体が正規かどうかの判定に使える**ため、分かっているものは入れる。省略＝未調査であって「HOME内完結」の意味ではない"
        },
        "duplicateOf": { "type": "string", "description": "このエントリが別のエントリと同じ配信の重複であるとき、本来のエントリの id（ファイルをまたいでよい）。build の pokemon.json からは外れ、meta.json の redirects（重複id→本来のid）に出る。公開URL `/pokemon/{id}` は凍結なので、重複と分かってもエントリは消さずにこれを付ける" },
        "eventName": { "type": "string", "description": "配信の名前。日本で配信されたものは日本の一次表記（公式告知・ふしぎなカード）で書く。**日本で配信されていない海外向けの配信は英語の正式名のまま**にする（日本語名が存在しないものに訳を付けない。2026-10-06 ユーザー判断）。推測で訳さないこと" },
        "event": {
          "type": "object",
          "additionalProperties": false,
          "description": "この配信が行われた（記念する）大会・映画等の属性。⚠ 個体の出自大会ではない。例: 09016 ドータクンは WCS2022シニア王者の個体だが PJCS2023 で配信されたので event は PJCS2023 を指す。tournament系フィールドをここに畳む",
          "properties": {
            "kind": { "enum": ["movie", "wcs", "pjcs", "regional", "champions", "collab", "other"] },
            "year": { "type": "integer", "description": "その大会の開催年。⚠ 実体の名称と一致しないことがある（08021 は kind:pjcs/year:2020 だが実体は「日本一決定戦2020」。PJCS2020 はコロナ禍で中止）。'{kind}{year}' を大会名として描画しないこと" },
            "schedule": { "type": "string" },
            "location": { "type": "string" },
            "winner": { "type": "string", "description": "⚠ **その大会の優勝者**であって、配信個体の持ち主ではない。PJCS配信は 2019〜2025 について「前年の王者の個体を配る」形だったため両者はズレる（2026 は王者個体の配布自体が無い）。個体の持ち主を出したいときは winner を流用せず、別フィールドを立てること" },
            "winnerX": { "type": "string", "description": "winner の X アカウント（@ 抜き）" }
          }
        },
        "distributionMethod": { "type": "string", "description": "mappings/distribution-methods.json の値集合に存在すること" },
        "distributionLocation": { "type": "string" },
        "startDate": { "type": "string", "pattern": "^\\d{4}-\\d{2}-\\d{2}$", "description": "「プレイヤーがそのポケモンを受け取れた期間」の開始日。配布・イベントの開始日（シリアルコードなら配布開始日）を入れる。⚠ 日本でも受け取れる配信（全世界を含む）は日本公式（pokemon.co.jp 等）の日付（日本時間）を正とする。日本で受け取れない海外だけの配信は、その地域の公式が書いている現地の日付を入れ、日本時間に換算しない（例: 08022 は米国公式の告知で 8/22 11:00 PDT 開始の番組内であいことばを公開 → 2020-08-22。日本時間では 8/23）。Bulbapedia の日付は UTC 基準などで1日ズレることがあり、そのまま入れない" },
        "endDate": { "type": "string", "pattern": "^\\d{4}-\\d{2}-\\d{2}$", "description": "「プレイヤーがそのポケモンを受け取れた期間」の最終日。⚠ 店頭でのコード配布終了日ではなく、**受け取りの期限**（シリアルコードなら有効期限）を入れる。例: 色違いムゲンダイナは実施2022/10/21-11/17・コード有効期限11/24 → endDate は 2022-11-24。地域ごとに期限が違う配信は日本の期間を採用し、他地域は notes に書く。日付の時間帯は startDate と同じ（日本で受け取れるなら日本時間、海外だけなら現地の日付）。省略＝無期限または未定" },
        "region": {
          "type": "array",
          "items": { "type": "string" },
          "description": "配布地域の配列。mappings/regions.json の値集合に存在すること"
        },
        "level": { "type": "integer", "minimum": 1, "maximum": 100 },
        "levelNote": { "type": "string", "description": "非数値レベル（例: 'Lv.50相当(非表示)'）の受け皿" },
        "gender": { "type": "string" },
        "nature": { "type": "string", "description": "mappings/natures.json の name_ja に存在すること。「ランダム」＝固定ネイチャー無しと判明した場合の許容値（省略＝不明とは区別）" },
        "ability": { "type": "string", "description": "abilities/all.json の name_ja に存在すること" },
        "ball": { "type": "string", "description": "mappings/balls.json の値集合に存在すること" },
        "metLocation": { "type": "string" },
        "heldItem": { "type": "string" },
        "teraType": { "type": "string" },
        "shiny": { "enum": ["fixed", "conditional"], "description": "fixed=確定色違い / conditional=条件次第。通常色は省略" },
        "ot": {
          "type": "object",
          "additionalProperties": { "type": "string" },
          "description": "言語キー→OT名（JPN/ENG/SPA/FRE/GER/ITA/KOR/CHS/CHT/SPA_EU/SPA_LA）"
        },
        "otFromPlayer": { "const": true, "description": "OTがプレイヤー自身（ot は持たない）" },
        "trainerId": { "type": "string", "description": "必ず文字列（先頭ゼロ保護）" },
        "moves": { "type": "array", "items": { "type": "string" } },
        "specialMoves": { "type": "array", "items": { "type": "string" } },
        "moveByTeraType": {
          "type": "object",
          "required": ["slot", "map"],
          "additionalProperties": false,
          "description": "テラスタイプで1枠の技が決まる配信（例: キミだけのミュウ）。moves[slot] は目印の「（テラスタイプで変わる）」にし、実際の技は map に持つ",
          "properties": {
            "slot": { "type": "integer", "minimum": 0, "maximum": 3, "description": "moves の何番目（0始まり）が変わるか" },
            "map": { "type": "object", "minProperties": 1, "additionalProperties": { "type": "string" }, "description": "テラスタイプ名（mappings/types.json の日本語名）→ 技名" }
          }
        },
        "ribbons": { "type": "array", "items": { "type": "string" }, "description": "mappings/ribbons.json の値集合に存在すること" },
        "ivs": {
          "type": "object",
          "additionalProperties": false,
          "description": "確定個体値のみ。ivsGuaranteed とは排他",
          "properties": {
            "hp": { "type": "integer", "minimum": 0, "maximum": 31 },
            "atk": { "type": "integer", "minimum": 0, "maximum": 31 },
            "def": { "type": "integer", "minimum": 0, "maximum": 31 },
            "spa": { "type": "integer", "minimum": 0, "maximum": 31 },
            "spd": { "type": "integer", "minimum": 0, "maximum": 31 },
            "spe": { "type": "integer", "minimum": 0, "maximum": 31 }
          }
        },
        "ivsGuaranteed": { "type": "integer", "minimum": 0, "maximum": 6, "description": "確定V個数（例: 3V→3）。0＝保証なし（ランダム）。ivs とは排他。ivs も ivsGuaranteed も無い＝個体値は不明（ランダムとはみなさない）" },
        "evs": { "type": "string", "description": "努力値（例: 'H36/B4/C214/D28/S228'）。構造化は将来" },
        "gigantamax": { "const": true },
        "alpha": { "const": true, "description": "オヤブン（LA/ZA）" },
        "password": { "type": "string" },
        "notes": { "type": "string", "description": "読者向けの備考。作業メモ（統合・修正の記録）や確認日・出典URLは書かない（verified / references / git 履歴へ）" },
        "postUrl": { "type": "string" },
        "verified": {
          "type": "object",
          "required": ["method", "fields"],
          "additionalProperties": false,
          "description": "pokebros が現物で確かめた項目。個別ページに「確認済み」として出す",
          "properties": {
            "method": { "enum": ["in-game", "official-image"], "description": "in-game=実機で確認 / official-image=公式の告知画像で確認" },
            "fields": {
              "type": "array",
              "minItems": 1,
              "items": { "enum": ["ability", "nature", "moves", "ball", "heldItem", "level", "gender", "ot", "trainerId", "metLocation", "ribbons"] }
            },
            "date": { "type": "string", "pattern": "^\\d{4}-\\d{2}-\\d{2}$" }
          }
        },
        "references": {
          "type": "array",
          "minItems": 1,
          "description": "読者に示す出典（公式告知など）。データの取得元の記録は source",
          "items": {
            "type": "object",
            "required": ["url"],
            "additionalProperties": false,
            "properties": {
              "url": { "type": "string" },
              "label": { "type": "string" }
            }
          }
        },
        "source": {
          "type": "object",
          "required": ["kind"],
          "additionalProperties": false,
          "properties": {
            "url": { "type": "string" },
            "kind": { "enum": ["bulbapedia", "official", "self"] },
            "note": { "type": "string" }
          }
        }
      }
    }
  }
}
