{
  "schemaVersion": 1,
  "dataset": "gen3",
  "generation": 3,
  "provenance": "scraper:bulbapedia",
  "datasetNotes": [
    "日本語版向けの配信一覧を対象とし、海外で配信されたものも含みます。",
    "配布方式はテンプレートから抽出できないため「未確認」としています。",
    "配信名や日付は資料に基づいており、公式資料・実機との照合は未完了です。",
    "この一覧は配信の網羅性を保証するものではありません。",
    "配信名には原資料を日本語化した表示名を含みます。当時の公式名称との照合は未完了です。"
  ],
  "entries": [
    {
      "id": "03001",
      "dexNo": 371,
      "pokemonName": "タツベイ",
      "games": [
        "ruby",
        "sapphire"
      ],
      "eventName": "ポケモンセンター5周年記念タマゴ／タツベイ（ねがいごと）",
      "distributionMethod": "未確認",
      "startDate": "2003-04-25",
      "endDate": "2003-05-18",
      "level": 5,
      "gender": "ランダム",
      "nature": "ランダム",
      "ability": "いしあたま",
      "ball": "モンスターボール",
      "shiny": "conditional",
      "otFromPlayer": true,
      "moves": [
        "いかり",
        "かみつく",
        "ねがいごと"
      ],
      "notes": "配布方式は未確認（テンプレートから抽出できないため）。 出会った場所は孵化した場所（具体的な場所は未確認）。 配信名は原資料を日本語化した表示名です（当時の公式名称は未確認）。",
      "source": {
        "kind": "bulbapedia",
        "url": "https://bulbapedia.bulbagarden.net/wiki/List_of_Japanese_event_Pok%C3%A9mon_distributions_in_Generation_III",
        "note": "原資料の配信名: Pokémon Center 5th Anniversary Eggs / Wish Bagon"
      },
      "references": [
        {
          "url": "https://bulbapedia.bulbagarden.net/wiki/List_of_Japanese_event_Pok%C3%A9mon_distributions_in_Generation_III",
          "label": "Bulbapedia（日本語版向け配信一覧）"
        }
      ]
    },
    {
      "id": "03002",
      "dexNo": 371,
      "pokemonName": "タツベイ",
      "games": [
        "ruby",
        "sapphire"
      ],
      "eventName": "ポケモンセンター5周年記念タマゴ／タツベイ（てっぺき）",
      "distributionMethod": "未確認",
      "startDate": "2003-04-25",
      "endDate": "2003-05-18",
      "level": 5,
      "gender": "ランダム",
      "nature": "ランダム",
      "ability": "いしあたま",
      "ball": "モンスターボール",
      "shiny": "conditional",
      "otFromPlayer": true,
      "moves": [
        "いかり",
        "かみつく",
        "てっぺき"
      ],
      "notes": "配布方式は未確認（テンプレートから抽出できないため）。 出会った場所は孵化した場所（具体的な場所は未確認）。 配信名は原資料を日本語化した表示名です（当時の公式名称は未確認）。",
      "source": {
        "kind": "bulbapedia",
        "url": "https://bulbapedia.bulbagarden.net/wiki/List_of_Japanese_event_Pok%C3%A9mon_distributions_in_Generation_III",
        "note": "原資料の配信名: Pokémon Center 5th Anniversary Eggs / Iron Defense Bagon"
      },
      "references": [
        {
          "url": "https://bulbapedia.bulbagarden.net/wiki/List_of_Japanese_event_Pok%C3%A9mon_distributions_in_Generation_III",
          "label": "Bulbapedia（日本語版向け配信一覧）"
        }
      ]
    },
    {
      "id": "03003",
      "dexNo": 359,
      "pokemonName": "アブソル",
      "games": [
        "ruby",
        "sapphire"
      ],
      "eventName": "ポケモンセンター5周年記念タマゴ／アブソル（ねがいごと）",
      "distributionMethod": "未確認",
      "startDate": "2003-04-25",
      "endDate": "2003-05-18",
      "level": 5,
      "gender": "ランダム",
      "nature": "ランダム",
      "ability": "プレッシャー",
      "ball": "モンスターボール",
      "shiny": "conditional",
      "otFromPlayer": true,
      "moves": [
        "ひっかく",
        "にらみつける",
        "ねがいごと"
      ],
      "notes": "配布方式は未確認（テンプレートから抽出できないため）。 出会った場所は孵化した場所（具体的な場所は未確認）。 配信名は原資料を日本語化した表示名です（当時の公式名称は未確認）。",
      "source": {
        "kind": "bulbapedia",
        "url": "https://bulbapedia.bulbagarden.net/wiki/List_of_Japanese_event_Pok%C3%A9mon_distributions_in_Generation_III",
        "note": "原資料の配信名: Pokémon Center 5th Anniversary Eggs / Wish Absol"
      },
      "references": [
        {
          "url": "https://bulbapedia.bulbagarden.net/wiki/List_of_Japanese_event_Pok%C3%A9mon_distributions_in_Generation_III",
          "label": "Bulbapedia（日本語版向け配信一覧）"
        }
      ]
    },
    {
      "id": "03004",
      "dexNo": 359,
      "pokemonName": "アブソル",
      "games": [
        "ruby",
        "sapphire"
      ],
      "eventName": "ポケモンセンター5周年記念タマゴ／アブソル（うらみ）",
      "distributionMethod": "未確認",
      "startDate": "2003-04-25",
      "endDate": "2003-05-18",
      "level": 5,
      "gender": "ランダム",
      "nature": "ランダム",
      "ability": "プレッシャー",
      "ball": "モンスターボール",
      "shiny": "conditional",
      "otFromPlayer": true,
      "moves": [
        "ひっかく",
        "にらみつける",
        "うらみ"
      ],
      "notes": "配布方式は未確認（テンプレートから抽出できないため）。 出会った場所は孵化した場所（具体的な場所は未確認）。 配信名は原資料を日本語化した表示名です（当時の公式名称は未確認）。",
      "source": {
        "kind": "bulbapedia",
        "url": "https://bulbapedia.bulbagarden.net/wiki/List_of_Japanese_event_Pok%C3%A9mon_distributions_in_Generation_III",
        "note": "原資料の配信名: Pokémon Center 5th Anniversary Eggs / Spite Absol"
      },
      "references": [
        {
          "url": "https://bulbapedia.bulbagarden.net/wiki/List_of_Japanese_event_Pok%C3%A9mon_distributions_in_Generation_III",
          "label": "Bulbapedia（日本語版向け配信一覧）"
        }
      ]
    },
    {
      "id": "03005",
      "dexNo": 280,
      "pokemonName": "ラルトス",
      "games": [
        "ruby",
        "sapphire"
      ],
      "eventName": "ポケモンセンター5周年記念タマゴ／ラルトス（ねがいごと）",
      "distributionMethod": "未確認",
      "startDate": "2003-04-25",
      "endDate": "2003-05-18",
      "level": 5,
      "gender": "ランダム",
      "nature": "ランダム",
      "ability": "シンクロ",
      "ball": "モンスターボール",
      "shiny": "conditional",
      "otFromPlayer": true,
      "moves": [
        "なきごえ",
        "ねがいごと"
      ],
      "notes": "配布方式は未確認（テンプレートから抽出できないため）。 出会った場所は孵化した場所（具体的な場所は未確認）。 配信名は原資料を日本語化した表示名です（当時の公式名称は未確認）。",
      "source": {
        "kind": "bulbapedia",
        "url": "https://bulbapedia.bulbagarden.net/wiki/List_of_Japanese_event_Pok%C3%A9mon_distributions_in_Generation_III",
        "note": "原資料の配信名: Pokémon Center 5th Anniversary Eggs / Wish Ralts"
      },
      "references": [
        {
          "url": "https://bulbapedia.bulbagarden.net/wiki/List_of_Japanese_event_Pok%C3%A9mon_distributions_in_Generation_III",
          "label": "Bulbapedia（日本語版向け配信一覧）"
        }
      ]
    },
    {
      "id": "03006",
      "dexNo": 280,
      "pokemonName": "ラルトス",
      "games": [
        "ruby",
        "sapphire"
      ],
      "eventName": "ポケモンセンター5周年記念タマゴ／ラルトス（あまえる）",
      "distributionMethod": "未確認",
      "startDate": "2003-04-25",
      "endDate": "2003-05-18",
      "level": 5,
      "gender": "ランダム",
      "nature": "ランダム",
      "ability": "シンクロ",
      "ball": "モンスターボール",
      "shiny": "conditional",
      "otFromPlayer": true,
      "moves": [
        "なきごえ",
        "あまえる"
      ],
      "notes": "配布方式は未確認（テンプレートから抽出できないため）。 出会った場所は孵化した場所（具体的な場所は未確認）。 配信名は原資料を日本語化した表示名です（当時の公式名称は未確認）。",
      "source": {
        "kind": "bulbapedia",
        "url": "https://bulbapedia.bulbagarden.net/wiki/List_of_Japanese_event_Pok%C3%A9mon_distributions_in_Generation_III",
        "note": "原資料の配信名: Pokémon Center 5th Anniversary Eggs / Charm Ralts"
      },
      "references": [
        {
          "url": "https://bulbapedia.bulbagarden.net/wiki/List_of_Japanese_event_Pok%C3%A9mon_distributions_in_Generation_III",
          "label": "Bulbapedia（日本語版向け配信一覧）"
        }
      ]
    },
    {
      "id": "03007",
      "dexNo": 172,
      "pokemonName": "ピチュー",
      "games": [
        "ruby",
        "sapphire"
      ],
      "eventName": "ポケモンセンター5周年記念タマゴ／ピチュー（ねがいごと）",
      "distributionMethod": "未確認",
      "startDate": "2003-04-25",
      "endDate": "2003-05-18",
      "level": 5,
      "gender": "ランダム",
      "nature": "ランダム",
      "ability": "せいでんき",
      "ball": "モンスターボール",
      "shiny": "conditional",
      "otFromPlayer": true,
      "moves": [
        "でんきショック",
        "あまえる",
        "ねがいごと"
      ],
      "notes": "配布方式は未確認（テンプレートから抽出できないため）。 出会った場所は孵化した場所（具体的な場所は未確認）。 配信名は原資料を日本語化した表示名です（当時の公式名称は未確認）。",
      "source": {
        "kind": "bulbapedia",
        "url": "https://bulbapedia.bulbagarden.net/wiki/List_of_Japanese_event_Pok%C3%A9mon_distributions_in_Generation_III",
        "note": "原資料の配信名: Pokémon Center 5th Anniversary Eggs / Wish Pichu"
      },
      "references": [
        {
          "url": "https://bulbapedia.bulbagarden.net/wiki/List_of_Japanese_event_Pok%C3%A9mon_distributions_in_Generation_III",
          "label": "Bulbapedia（日本語版向け配信一覧）"
        }
      ]
    },
    {
      "id": "03008",
      "dexNo": 172,
      "pokemonName": "ピチュー",
      "games": [
        "ruby",
        "sapphire"
      ],
      "eventName": "ポケモンセンター5周年記念タマゴ／ピチュー（フラフラダンス）",
      "distributionMethod": "未確認",
      "startDate": "2003-04-25",
      "endDate": "2003-05-18",
      "level": 5,
      "gender": "ランダム",
      "nature": "ランダム",
      "ability": "せいでんき",
      "ball": "モンスターボール",
      "shiny": "conditional",
      "otFromPlayer": true,
      "moves": [
        "でんきショック",
        "あまえる",
        "フラフラダンス"
      ],
      "notes": "配布方式は未確認（テンプレートから抽出できないため）。 出会った場所は孵化した場所（具体的な場所は未確認）。 配信名は原資料を日本語化した表示名です（当時の公式名称は未確認）。",
      "source": {
        "kind": "bulbapedia",
        "url": "https://bulbapedia.bulbagarden.net/wiki/List_of_Japanese_event_Pok%C3%A9mon_distributions_in_Generation_III",
        "note": "原資料の配信名: Pokémon Center 5th Anniversary Eggs / Teeter Dance Pichu"
      },
      "references": [
        {
          "url": "https://bulbapedia.bulbagarden.net/wiki/List_of_Japanese_event_Pok%C3%A9mon_distributions_in_Generation_III",
          "label": "Bulbapedia（日本語版向け配信一覧）"
        }
      ]
    },
    {
      "id": "03009",
      "dexNo": 385,
      "pokemonName": "ジラーチ",
      "games": [
        "ruby",
        "sapphire"
      ],
      "eventName": "ネガイボシのジラーチ",
      "distributionMethod": "未確認",
      "startDate": "2003-06-21",
      "endDate": "2003-08-24",
      "level": 5,
      "nature": "ランダム",
      "ability": "てんのめぐみ",
      "ball": "モンスターボール",
      "heldItem": "カムラのみ / リュガのみ",
      "ot": {
        "JPN": "ネガイボシ"
      },
      "trainerId": "30719",
      "moves": [
        "ねがいごと",
        "ねんりき",
        "ねむる"
      ],